{
  "$schema": "https://json-schema.org/draft/2020-12/schema",
  "title": "ThieleReceiptV1",
  "type": "object",
  "required": ["steps", "global_digest", "kernel_pubkey", "signature", "spec_version"],
  "properties": {
    "spec_version": { "type": "string", "enum": ["1.0", "1.1"] },
    "kernel_pubkey": { "type": "string", "pattern": "^[0-9a-fA-F]{64}$" },
    "steps": {
      "type": "array",
      "items": { "$ref": "#/$defs/step" },
      "minItems": 1
    },
    "global_digest": { "type": "string", "pattern": "^[0-9a-fA-F]{64}$" },
    "signature": { "type": "string", "pattern": "^[0-9a-fA-F]{128}$" }
  },
  "$defs": {
    "step": {
      "type": "object",
      "required": ["idx","transition","mu_delta","step_hash","solver","solver_cmdline"],
      "properties": {
        "idx": { "type": "integer", "minimum": 0 },
        "transition": { "type": "string" },
        "mu_delta": { "type": ["number", "integer", "string"] },
        "post_state_hash": { "type": ["string","null"], "pattern": "^[0-9a-fA-F]{64}$" },
        "proof_portable": { "type": ["string","null"], "enum": ["LRAT","DRAT","TRUTH_TABLE_UNSAT",null] },
        "cnf_sha256": { "type": ["string","null"], "pattern": "^[0-9a-fA-F]{64}$" },
        "proof_blob_uri": { "type": ["string","null"] },
        "proof_sha256": { "type": ["string","null"], "pattern": "^[0-9a-fA-F]{64}$" },
        "model_blob_uri": { "type": ["string","null"] },
        "model_sha256": { "type": ["string","null"], "pattern": "^[0-9a-fA-F]{64}$" },
        "status": { "type": ["string","null"] },
        "signature": { "type": ["string","null"], "pattern": "^[0-9a-fA-F]{128}$" },
        "solver": { "type": "string" },
        "solver_commit": { "type": ["string","null"] },
        "solver_cmdline": { "type": "string" },
        "step_hash": { "type": "string", "pattern": "^[0-9a-fA-F]{64}$" }
      }
    }
  }
}