{
  "spec_version": "1.0",
  "kernel_pubkey": "2cf6bd7d858d8722e04f26a7a352cb6d076d423b56310b3e88d4d8d9a40407c0",
  "steps": [
    {
      "idx": 0,
      "transition": "xor_solve",
      "mu_delta": 1,
      "solver": "xor_solver",
      "solver_cmdline": "python scripts/make_golden.py",
      "step_hash": "a96d7feb6942b185cce63455eaab610df436bf0bfdd63d11f03139368b9ba3f7"
    }
  ],
  "global_digest": "4cb37632ac778f54d35773aed1ad81b86c866d1f7b0766ea25e1ffcd46e8e746",
  "signature": "110a39c15d872e6a88dff1ca97c7e410c841f6c960057bee0b4dc5a36051cffd0daf3e57a8449d902163d1a792d2cd4b44f15c7a061478dc8329d16a6e2f6c5d"
}